{
  "schema_version": "1.0",
  "summary": {
    "files_scanned": 2,
    "findings": 5,
    "errors": 0,
    "critical": 4,
    "high": 1,
    "medium": 0,
    "low": 0,
    "duration_ms": 3,
    "scanner_version": "1.0.0"
  },
  "findings": [
    {
      "rule_id": "internal.sensitive-env-var",
      "description": "Hardcoded sensitive credential in environment variable",
      "severity": "high",
      "confidence": "high",
      "file": "testdata/vulnerable/deployment.yaml",
      "line": 22,
      "column": 18,
      "field_path": "spec.template.spec.containers[0].env[0].value",
      "resource": "payment-processor",
      "kind": "Deployment",
      "match": "Supe****************d123"
    },
    {
      "rule_id": "internal.aws-access-key-id",
      "description": "AWS Access Key ID exposed",
      "severity": "critical",
      "confidence": "high",
      "file": "testdata/vulnerable/deployment.yaml",
      "line": 24,
      "column": 18,
      "field_path": "spec.template.spec.containers[0].env[1].value",
      "resource": "payment-processor",
      "kind": "Deployment",
      "match": "AKIA************MPLE"
    },
    {
      "rule_id": "internal.jwt-token",
      "description": "JSON Web Token (JWT) exposed",
      "severity": "critical",
      "confidence": "high",
      "file": "testdata/vulnerable/deployment.yaml",
      "line": 26,
      "column": 18,
      "field_path": "spec.template.spec.containers[0].env[2].value",
      "resource": "payment-processor",
      "kind": "Deployment",
      "match": "eyJh****************************************************************************************************************************sw5c"
    },
    {
      "rule_id": "internal.aws-secret-access-key",
      "description": "AWS Secret Access Key exposed in sensitive context",
      "severity": "critical",
      "confidence": "high",
      "file": "testdata/vulnerable/secret.yaml",
      "line": 10,
      "column": 26,
      "field_path": "data.aws_secret_access_key",
      "resource": "cloud-api-credentials",
      "kind": "Secret",
      "match": "wJal********************************EKEY"
    },
    {
      "rule_id": "internal.google-api-key",
      "description": "Google API Key exposed",
      "severity": "critical",
      "confidence": "high",
      "file": "testdata/vulnerable/secret.yaml",
      "line": 13,
      "column": 19,
      "field_path": "stringData.google_api_key",
      "resource": "cloud-api-credentials",
      "kind": "Secret",
      "match": "AIza*******************************2345"
    }
  ],
  "errors": []
}
